{
  "$schema": "./ctr-201-orchestrator-runtime.schema.json",
  "behavior_dimensions": [
    {
      "accepted_behavior": "Bounded offline control-flow matrix captured; live provider behavior remains downstream.",
      "case_ids": [
        "a8.orchestration-preview",
        "mcp.preview-controller-matrix",
        "mcp.run-agents-boolean-contract",
        "mcp.doctor-advisory-run-agents",
        "mcp.orchestrator-route-matrix",
        "task-plan.prerequisite-filesystem-matrix",
        "quality.artifact-existence-gate",
        "profile.builtin-and-custom-resolution",
        "profile.unknown-rejected",
        "execute.single-chain-role",
        "execute.parallel-triad",
        "execute.parallel-dual-degrade",
        "code-build.focus-routing",
        "code-build.legacy-standard",
        "code-build.legacy-advanced",
        "code-build.legacy-advanced-failure",
        "task-run.solo-observed-review",
        "task-run.duo-pass",
        "task-run.direct-triad-metadata-only",
        "task-run.triad-enabled",
        "task-run.primary-fallback",
        "task-run.block-revision-pass",
        "task-run.final-block",
        "task-run.draft-failure",
        "failure.policy-boundary-matrix",
        "worker.adapter-fallback",
        "worker.b1-success",
        "worker.b1-degrade",
        "worker.b1-merge-failure",
        "worker.b1-final-review-failure",
        "worker.b1-final-review-block",
        "worker.h3-block",
        "team-run.b1-planner-success",
        "team-run.b1-degrade",
        "team-run.b1-planner-fallback",
        "team-run.b1-all-workers-block",
        "team-run.b1-merge-failure",
        "team-run.b1-review-failure",
        "team-run.b1-review-block-observed",
        "team-run.h3-static-personas",
        "team-run.h3-block",
        "experience.replay-plan-advisory",
        "bridge.session-command-passthrough",
        "doctor.sanitized-environment"
      ],
      "decision_ids": [
        "CTR-201F-D001",
        "CTR-201F-D002",
        "CTR-201F-D005",
        "CTR-201F-D006"
      ],
      "id": "complete-runtime-behavior-matrix",
      "resolution": "captured-with-explicit-disposition"
    },
    {
      "accepted_behavior": "Single session passthrough and replay advice captured; durable task/team resume is absent.",
      "case_ids": [
        "execute.single-chain-role",
        "experience.replay-plan-advisory",
        "bridge.session-command-passthrough"
      ],
      "decision_ids": [
        "CTR-201F-D003"
      ],
      "id": "complete-state-and-resume",
      "resolution": "captured-accepted-absence"
    },
    {
      "accepted_behavior": "Dispatch and fallback decisions captured through deterministic bridge fakes; live agents are excluded.",
      "case_ids": [
        "mcp.run-agents-boolean-contract",
        "mcp.doctor-advisory-run-agents",
        "execute.single-chain-role",
        "execute.parallel-triad",
        "code-build.legacy-standard",
        "code-build.legacy-advanced",
        "task-run.duo-pass",
        "task-run.triad-enabled",
        "team-run.b1-planner-success"
      ],
      "decision_ids": [
        "CTR-201F-D001",
        "CTR-201F-D005"
      ],
      "id": "complete-agent-launch-behavior",
      "resolution": "captured-with-explicit-disposition"
    },
    {
      "accepted_behavior": "Accepted controller semantics captured, including solo review and direct triad flag behavior.",
      "case_ids": [
        "mcp.preview-controller-matrix",
        "task-run.solo-observed-review",
        "task-run.duo-pass",
        "task-run.direct-triad-metadata-only",
        "task-run.triad-enabled"
      ],
      "decision_ids": [
        "CTR-201F-D001"
      ],
      "id": "complete-solo-duo-triad-runtime-parity",
      "resolution": "captured-with-explicit-disposition"
    },
    {
      "accepted_behavior": "Deterministic failure policies captured; public cancellation and real process interruption are absent or downstream.",
      "case_ids": [
        "execute.parallel-dual-degrade",
        "code-build.legacy-advanced-failure",
        "task-run.primary-fallback",
        "task-run.block-revision-pass",
        "task-run.final-block",
        "task-run.draft-failure",
        "failure.policy-boundary-matrix",
        "worker.b1-degrade",
        "worker.b1-merge-failure",
        "worker.b1-final-review-failure",
        "worker.b1-final-review-block",
        "worker.h3-block",
        "team-run.b1-degrade",
        "team-run.b1-planner-fallback",
        "team-run.b1-all-workers-block",
        "team-run.b1-merge-failure",
        "team-run.b1-review-failure",
        "team-run.b1-review-block-observed",
        "team-run.h3-block"
      ],
      "decision_ids": [
        "CTR-201F-D002",
        "CTR-201F-D003"
      ],
      "id": "complete-failure-and-cancellation",
      "resolution": "captured-with-explicit-disposition"
    },
    {
      "accepted_behavior": "Artifact existence behavior captured; semantic Q1-Q4 execution is absent from accepted runtime.",
      "case_ids": [
        "quality.artifact-existence-gate"
      ],
      "decision_ids": [
        "CTR-201F-D004"
      ],
      "id": "complete-quality-gate-semantic-execution",
      "resolution": "captured-accepted-absence"
    }
  ],
  "capture_contract": {
    "dependency": "pure-python-pyyaml-6.0.3-capsule",
    "dependency_tree_sha256": "06f74e5c27433e236e83428ba11cc911d29217f68bc778b0396885699afb8992",
    "determinism": "two-distinct-temp-roots-and-environments-byte-equivalent",
    "fake_boundary": "bridge-mcp-availability-and-deterministic-identity-injection",
    "network_policy": "python-audit-denied",
    "os_sandbox_claim": "authenticated-source-capability-guard-not-hostile-code-os-sandbox",
    "process_policy": "worker-denies-child-processes;parent-launches-git-and-python-capture-processes",
    "python_isolation": "-I-S-B-dual-environment-audit-hook",
    "python_version": "python3.12",
    "secret_policy": "sanitized-environment-and-canary-rejection",
    "source_mode": "accepted-tag-git-blobs",
    "trace_order": "logical-order-preserved-only-concurrent-cohorts-canonicalized",
    "write_policy": "worker-denies-sut-writes;fixture-roots-before-after-measured"
  },
  "cases": [
    {
      "case_sha256": "41c56b4e5477103c9d8169cec70c22349cf3d122cb7b1e72900bdbe924f4d3d4",
      "declaration_ordinal": 0,
      "dimension_ids": [
        "complete-runtime-behavior-matrix"
      ],
      "effects": {
        "after_tree_sha256": "4f53cda18c2baa0c0354bb5f9a3ecbe5ed12ab4d8e11ba873c2f11161202b945",
        "before_tree_sha256": "4f53cda18c2baa0c0354bb5f9a3ecbe5ed12ab4d8e11ba873c2f11161202b945",
        "changed_path_count": 0,
        "changed_paths_sha256": "4f53cda18c2baa0c0354bb5f9a3ecbe5ed12ab4d8e11ba873c2f11161202b945"
      },
      "group": "mcp",
      "id": "a8.orchestration-preview",
      "input_facts": [
        {
          "key": "task_id",
          "value": "F3"
        },
        {
          "key": "run_agents",
          "value": "false"
        }
      ],
      "operation": "tools/call qiongli_task_run",
      "outcome": {
        "exception_message_sha256": "e3b0c44298fc1c149afbf4c8996fb92427ae41e4649b934ca495991b7852b855",
        "exception_type": "",
        "kind": "result",
        "result_sha256": "3a17a037638d067d5cd8760ce7223389c7db3fb0b1a3769ac549e880541565a1"
      },
      "provenance": "accepted-a8-oracle",
      "result_facts": [
        {
          "key": "mode",
          "value": "task-run-preview"
        },
        {
          "key": "will_launch_agents",
          "value": "false"
        }
      ],
      "trace": []
    },
    {
      "case_sha256": "57a073550952392e67fd4773b9d511d89079378e330498befb5a32f98951ab0d",
      "declaration_ordinal": 1,
      "dimension_ids": [
        "complete-runtime-behavior-matrix",
        "complete-solo-duo-triad-runtime-parity"
      ],
      "effects": {
        "after_tree_sha256": "409875e29ac9c95f697086c2c35a47ea61e13fd17440abca75ca8ab23e7d0a4f",
        "before_tree_sha256": "409875e29ac9c95f697086c2c35a47ea61e13fd17440abca75ca8ab23e7d0a4f",
        "changed_path_count": 0,
        "changed_paths_sha256": "4f53cda18c2baa0c0354bb5f9a3ecbe5ed12ab4d8e11ba873c2f11161202b945"
      },
      "group": "mcp",
      "id": "mcp.preview-controller-matrix",
      "input_facts": [
        {
          "key": "run_agents",
          "value": "false"
        }
      ],
      "operation": "_tool_task_run preview matrix",
      "outcome": {
        "exception_message_sha256": "e3b0c44298fc1c149afbf4c8996fb92427ae41e4649b934ca495991b7852b855",
        "exception_type": "",
        "kind": "result",
        "result_sha256": "916a160281bad88a0b7a1742ad86252c9f55e8b188e2db0f369156c6f065ddaf"
      },
      "provenance": "accepted-source-bounded-runtime",
      "result_facts": [
        {
          "key": "preview_matrix",
          "value": "{\"duo\":{\"execution_mode\":\"duo\",\"mode\":\"task-run-preview\",\"run_agents\":false,\"will_launch_agents\":false},\"solo\":{\"execution_mode\":\"solo\",\"mode\":\"task-run-preview\",\"run_agents\":false,\"will_launch_agents\":false},\"triad\":{\"execution_mode\":\"triad\",\"mode\":\"task-run-preview\",\"run_agents\":false,\"will_launch_agents\":false}}"
        }
      ],
      "trace": []
    },
    {
      "case_sha256": "08e307287b9a46b6209dc2db8910efeaa9229f8f04d52281eeec8ef7ce89a9e7",
      "declaration_ordinal": 2,
      "dimension_ids": [
        "complete-runtime-behavior-matrix",
        "complete-agent-launch-behavior"
      ],
      "effects": {
        "after_tree_sha256": "409875e29ac9c95f697086c2c35a47ea61e13fd17440abca75ca8ab23e7d0a4f",
        "before_tree_sha256": "409875e29ac9c95f697086c2c35a47ea61e13fd17440abca75ca8ab23e7d0a4f",
        "changed_path_count": 0,
        "changed_paths_sha256": "4f53cda18c2baa0c0354bb5f9a3ecbe5ed12ab4d8e11ba873c2f11161202b945"
      },
      "group": "mcp",